{
  "magic": "PWSAVE",
  "schema_version": 1,
  "document_kind": "profile",
  "profile_id": "slot_1",
  "save_domain": "base",
  "sequence": 12,
  "game_version": "0.4.0-dev",
  "created_at_utc": "2026-09-28T08:00:00Z",
  "saved_at_utc": "2026-09-28T09:00:00Z",
  "content_snapshot": {
    "aggregate_sha256": "3ea513ffe38dacd241522b087c5c39b28aa67e2d691bd8de68298661fe39c8d4",
    "packs": [
      {
        "pack_id": "base",
        "pack_version": "0.4.0-dev",
        "schema_version": 1,
        "fingerprint_sha256": "1111111111111111111111111111111111111111111111111111111111111111"
      },
      {
        "pack_id": "m1_bonus",
        "pack_version": "1.0.0",
        "schema_version": 1,
        "fingerprint_sha256": "2222222222222222222222222222222222222222222222222222222222222222"
      }
    ]
  },
  "payload": {
    "chronos_shards": 21,
    "existential_imprints": 5,
    "unlocked_characters": ["wanderer"],
    "unlocked_weapons": ["sword"],
    "runs_completed": 6,
    "victories": 2,
    "best_rooms_cleared": 5,
    "last_run_summary": {"result": "floor_cleared", "rooms_cleared": 5}
  },
  "integrity": {
    "algorithm": "sha256",
    "digest": "905f65389a398e043f8d86f95aa356889e1624691bd549444a816f5cc3e7c614"
  }
}
